Issue Key,Summary,Issue Type,Status,Priority,Assignee,Reporter,Created,Updated,Resolved,Story Points,Sprint,Description,Labels
ACME-966,Tooltip accessibility not invalidated on update,Bug,Done,High,Maya Kowalski,Marc Dubois,21/Nov/24 12:00 AM,22/Nov/24 12:00 AM,22/Nov/24 12:00 AM,2,Sprint 6,**Bug:** tooltip accessibility not invalidated after update **Impact:** Stale data shown.,search
ACME-967,Configure public status page,Story,Done,Medium,Maya Kowalski,Marc Dubois,07/Nov/24 12:00 AM,09/Nov/24 12:00 AM,09/Nov/24 12:00 AM,3,Sprint 6,"As a developer, I need to configure public status page for better reliability.",reporting
ACME-968,Configure database migrations,Story,Done,Medium,Maya Kowalski,Marc Dubois,03/Nov/24 12:00 AM,04/Nov/24 12:00 AM,04/Nov/24 12:00 AM,2,Sprint 6,"As a developer, I need to configure database migrations for better reliability.",ui
ACME-969,Public status page timeout on large payload,Bug,In Progress,Medium,Maya Kowalski,Sophie Renard,14/Nov/24 12:00 AM,15/Nov/24 12:00 AM,,2,Sprint 6,**Bug:** public status page times out on large payloads **Impact:** Affects power users.,ux
ACME-970,Extend Kubernetes autoscaling,Story,Done,Medium,Maya Kowalski,Alice Martin,11/Nov/24 12:00 AM,12/Nov/24 12:00 AM,12/Nov/24 12:00 AM,2,Sprint 5,"As a developer, I want to extend Kubernetes autoscaling to support new use cases.",frontend
ACME-971,Optimize Salesforce connector,Story,In Progress,Medium,Maya Kowalski,David Chen,08/Nov/24 12:00 AM,09/Nov/24 12:00 AM,,8,Sprint 5,"As a developer, I need to optimize Salesforce connector to improve performance.",integration
ACME-972,Prometheus metrics breaks on concurrent requests,Bug,Done,Low,Maya Kowalski,Alice Martin,21/Nov/24 12:00 AM,22/Nov/24 12:00 AM,22/Nov/24 12:00 AM,1,Sprint 6,**Bug:** Prometheus metrics breaks under concurrent load **Impact:** Race condition in production.,regression
ACME-973,Configure event sourcing,Story,Done,High,Maya Kowalski,Marc Dubois,13/Nov/24 12:00 AM,16/Nov/24 12:00 AM,16/Nov/24 12:00 AM,3,Sprint 6,"As a developer, I need to configure event sourcing for better reliability.",security
ACME-974,Configure vector database,Story,Done,Medium,Maya Kowalski,Marc Dubois,14/Nov/24 12:00 AM,15/Nov/24 12:00 AM,15/Nov/24 12:00 AM,1,Sprint 6,"As a developer, I need to configure vector database for better reliability.",bug
ACME-975,Refactor saved filter presets,Story,Done,Medium,Maya Kowalski,Marc Dubois,25/Nov/24 12:00 AM,28/Nov/24 12:00 AM,28/Nov/24 12:00 AM,2,Sprint 6,"As a developer, I need to refactor saved filter presets to maintain code quality.",performance
ACME-976,Implement keyboard shortcuts,Story,Done,High,Maya Kowalski,Marc Dubois,10/Nov/24 12:00 AM,11/Nov/24 12:00 AM,11/Nov/24 12:00 AM,13,Sprint 6,"As a developer, I need to implement keyboard shortcuts to improve scalability.",performance
ACME-977,Refactor model fine-tuning,Story,Done,Medium,Jules Nguyen,Sophie Renard,16/Nov/24 12:00 AM,17/Nov/24 12:00 AM,17/Nov/24 12:00 AM,1,Sprint 6,"As a developer, I need to refactor model fine-tuning to maintain code quality.",search
ACME-978,Build loading skeletons,Story,Won't Fix,Low,Jules Nguyen,David Chen,10/Nov/24 12:00 AM,11/Nov/24 12:00 AM,,2,Sprint 6,"As an admin, I want to build loading skeletons to improve the team workflow.",api
ACME-979,Set up JWT middleware,Story,In Progress,Medium,Jules Nguyen,Alice Martin,07/Nov/24 12:00 AM,09/Nov/24 12:00 AM,,2,Sprint 5,"As a developer, I need to set up JWT middleware for operational readiness.",regression
ACME-980,Migrate email templates,Story,Done,Medium,Jules Nguyen,Sophie Renard,27/Nov/24 12:00 AM,30/Nov/24 12:00 AM,30/Nov/24 12:00 AM,5,Sprint 6,"As a developer, I need to migrate email templates to reduce technical debt.",regression
ACME-981,Add loading skeletons,Story,Done,High,Jules Nguyen,Sophie Renard,04/Nov/24 12:00 AM,08/Nov/24 12:00 AM,08/Nov/24 12:00 AM,1,Sprint 6,"As a user, I want to add loading skeletons to get more value from the platform.",bug
ACME-982,Optimize prompt safety layer,Story,Done,Medium,Jules Nguyen,Alice Martin,14/Nov/24 12:00 AM,19/Nov/24 12:00 AM,19/Nov/24 12:00 AM,13,Sprint 6,"As a developer, I need to optimize prompt safety layer to improve performance.",backend
ACME-983,Build Celery task queue,Story,Done,Medium,Jules Nguyen,Marc Dubois,02/Nov/24 12:00 AM,05/Nov/24 12:00 AM,05/Nov/24 12:00 AM,5,Sprint 5,"As an admin, I want to build Celery task queue to improve the team workflow.",integration
ACME-984,Refactor OAuth2 flow,Story,Done,Low,Jules Nguyen,Alice Martin,03/Nov/24 12:00 AM,05/Nov/24 12:00 AM,05/Nov/24 12:00 AM,3,Sprint 5,"As a developer, I need to refactor OAuth2 flow to maintain code quality.",reporting
ACME-985,Audit log viewer timeout on large payload,Bug,In Progress,Low,Jules Nguyen,Marc Dubois,26/Nov/24 12:00 AM,30/Nov/24 12:00 AM,,8,Sprint 5,**Bug:** audit log viewer times out on large payloads **Impact:** Affects power users.,infra
ACME-986,Integrate notification center,Story,Done,Highest,Sofia Benali,Sophie Renard,16/Nov/24 12:00 AM,18/Nov/24 12:00 AM,18/Nov/24 12:00 AM,5,Sprint 5,"As a user, I want to integrate notification center so that workflows are automated.",performance
ACME-987,Integrate tooltip accessibility,Story,In Progress,Low,Sofia Benali,Marc Dubois,13/Nov/24 12:00 AM,16/Nov/24 12:00 AM,,1,Sprint 5,"As a user, I want to integrate tooltip accessibility so that workflows are automated.",api
ACME-988,Implement data export scheduler,Story,Done,Low,Sofia Benali,Sophie Renard,08/Nov/24 12:00 AM,11/Nov/24 12:00 AM,11/Nov/24 12:00 AM,2,Sprint 6,"As a developer, I need to implement data export scheduler to improve scalability.",infra
ACME-989,Migrate Slack notifications,Story,Done,Medium,Sofia Benali,Sophie Renard,22/Nov/24 12:00 AM,28/Nov/24 12:00 AM,28/Nov/24 12:00 AM,1,Sprint 5,"As a developer, I need to migrate Slack notifications to reduce technical debt.",regression
ACME-990,Integrate feature flags,Story,Done,Medium,Sofia Benali,David Chen,24/Nov/24 12:00 AM,26/Nov/24 12:00 AM,26/Nov/24 12:00 AM,3,Sprint 5,"As a user, I want to integrate feature flags so that workflows are automated.",api
ACME-991,Optimize feature flags,Story,Done,High,Sofia Benali,Sophie Renard,13/Nov/24 12:00 AM,17/Nov/24 12:00 AM,17/Nov/24 12:00 AM,5,Sprint 5,"As a developer, I need to optimize feature flags to improve performance.",reporting
ACME-992,Referral tracking memory leak detected,Bug,Done,Medium,Sofia Benali,Marc Dubois,15/Nov/24 12:00 AM,17/Nov/24 12:00 AM,17/Nov/24 12:00 AM,2,Sprint 5,**Bug:** memory leak in referral tracking **Impact:** Service degrades over time.,reporting
ACME-993,Migrate Docker build,Story,Done,Medium,Sofia Benali,Marc Dubois,16/Nov/24 12:00 AM,19/Nov/24 12:00 AM,19/Nov/24 12:00 AM,13,Sprint 6,"As a developer, I need to migrate Docker build to reduce technical debt.",bug
ACME-994,Jwt middleware crashes on null input,Bug,Done,Medium,Sofia Benali,Marc Dubois,21/Nov/24 12:00 AM,22/Nov/24 12:00 AM,22/Nov/24 12:00 AM,1,Sprint 5,**Bug:** JWT middleware crashes when input is null **Impact:** Affects edge cases.,api
ACME-995,Implement sandbox environment,Story,Done,High,Sofia Benali,Sophie Renard,10/Nov/24 12:00 AM,13/Nov/24 12:00 AM,13/Nov/24 12:00 AM,13,Sprint 5,"As a developer, I need to implement sandbox environment to improve scalability.",reporting
ACME-996,Optimize webhook retry logic,Story,Done,Medium,Sofia Benali,David Chen,17/Nov/24 12:00 AM,19/Nov/24 12:00 AM,19/Nov/24 12:00 AM,2,Sprint 6,"As a developer, I need to optimize webhook retry logic to improve performance.",frontend
ACME-997,Implement Slack notifications,Story,Done,Medium,Sofia Benali,Sophie Renard,05/Nov/24 12:00 AM,09/Nov/24 12:00 AM,09/Nov/24 12:00 AM,13,Sprint 5,"As a developer, I need to implement Slack notifications to improve scalability.",search
ACME-998,Optimize custom metrics dashboard,Story,In Progress,High,Sofia Benali,Marc Dubois,18/Nov/24 12:00 AM,22/Nov/24 12:00 AM,,8,Sprint 5,"As a developer, I need to optimize custom metrics dashboard to improve performance.",ui
ACME-999,Configure sandbox environment,Story,Done,Low,Sofia Benali,Alice Martin,07/Nov/24 12:00 AM,09/Nov/24 12:00 AM,09/Nov/24 12:00 AM,13,Sprint 6,"As a developer, I need to configure sandbox environment for better reliability.",ux
ACME-1000,Set up Salesforce connector,Story,In Progress,Medium,Sofia Benali,Marc Dubois,07/Nov/24 12:00 AM,08/Nov/24 12:00 AM,,3,Sprint 6,"As a developer, I need to set up Salesforce connector for operational readiness.",backend
ACME-1001,Add onboarding checklist,Story,Done,Low,Sofia Benali,Alice Martin,08/Nov/24 12:00 AM,09/Nov/24 12:00 AM,09/Nov/24 12:00 AM,8,Sprint 5,"As a user, I want to add onboarding checklist to get more value from the platform.",integration
ACME-1002,Extend referral tracking,Story,Done,Highest,Sofia Benali,Alice Martin,03/Nov/24 12:00 AM,05/Nov/24 12:00 AM,05/Nov/24 12:00 AM,13,Sprint 6,"As a developer, I want to extend referral tracking to support new use cases.",search
ACME-1003,Configure Prometheus metrics,Story,Done,Medium,Eva Moreau,David Chen,22/Nov/24 12:00 AM,23/Nov/24 12:00 AM,23/Nov/24 12:00 AM,1,Sprint 5,"As a developer, I need to configure Prometheus metrics for better reliability.",ui
ACME-1004,Build health check endpoints,Story,Done,Highest,Eva Moreau,Marc Dubois,12/Nov/24 12:00 AM,14/Nov/24 12:00 AM,14/Nov/24 12:00 AM,8,Sprint 5,"As an admin, I want to build health check endpoints to improve the team workflow.",security
ACME-1005,Implement Terraform modules,Story,Done,Medium,Eva Moreau,David Chen,19/Nov/24 12:00 AM,23/Nov/24 12:00 AM,23/Nov/24 12:00 AM,5,Sprint 6,"As a developer, I need to implement Terraform modules to improve scalability.",reporting
ACME-1006,Integrate search autocomplete,Story,Done,High,Eva Moreau,Sophie Renard,02/Nov/24 12:00 AM,04/Nov/24 12:00 AM,04/Nov/24 12:00 AM,8,Sprint 6,"As a user, I want to integrate search autocomplete so that workflows are automated.",backend
ACME-1007,Optimize GraphQL schema,Story,In Progress,High,Eva Moreau,David Chen,03/Nov/24 12:00 AM,05/Nov/24 12:00 AM,,8,Sprint 6,"As a developer, I need to optimize GraphQL schema to improve performance.",ux
ACME-1008,Optimize Celery task queue,Story,Done,Medium,Eva Moreau,Alice Martin,19/Nov/24 12:00 AM,21/Nov/24 12:00 AM,21/Nov/24 12:00 AM,2,Sprint 5,"As a developer, I need to optimize Celery task queue to improve performance.",performance
ACME-1009,Public status page fails silently,Bug,To Do,Medium,Eva Moreau,David Chen,13/Nov/24 12:00 AM,14/Nov/24 12:00 AM,,2,Sprint 6,**Bug:** public status page fails silently **Impact:** Affects users in production.,security
ACME-1010,Integrate tooltip accessibility,Story,In Progress,High,Eva Moreau,Alice Martin,17/Nov/24 12:00 AM,20/Nov/24 12:00 AM,,8,Sprint 5,"As a user, I want to integrate tooltip accessibility so that workflows are automated.",ui
ACME-1011,Configure dark mode toggle,Story,Done,Highest,Eva Moreau,Sophie Renard,12/Nov/24 12:00 AM,13/Nov/24 12:00 AM,13/Nov/24 12:00 AM,2,Sprint 6,"As a developer, I need to configure dark mode toggle for better reliability.",security
ACME-1012,Set up search autocomplete,Story,Done,Medium,Eva Moreau,Marc Dubois,14/Nov/24 12:00 AM,18/Nov/24 12:00 AM,18/Nov/24 12:00 AM,8,Sprint 6,"As a developer, I need to set up search autocomplete for operational readiness.",frontend
ACME-1013,Migrate Postgres indexes,Story,Done,Medium,Eva Moreau,Marc Dubois,18/Nov/24 12:00 AM,20/Nov/24 12:00 AM,20/Nov/24 12:00 AM,1,Sprint 6,"As a developer, I need to migrate Postgres indexes to reduce technical debt.",reporting
ACME-1014,Migrate notification center,Story,To Do,Medium,Eva Moreau,Marc Dubois,06/Nov/24 12:00 AM,09/Nov/24 12:00 AM,,1,Sprint 6,"As a developer, I need to migrate notification center to reduce technical debt.",performance
ACME-1015,Refactor cohort retention analysis,Story,Done,Medium,Eva Moreau,Sophie Renard,07/Nov/24 12:00 AM,11/Nov/24 12:00 AM,11/Nov/24 12:00 AM,3,Sprint 6,"As a developer, I need to refactor cohort retention analysis to maintain code quality.",security
ACME-1016,Optimize sandbox environment,Story,Done,Medium,Eva Moreau,Sophie Renard,02/Nov/24 12:00 AM,06/Nov/24 12:00 AM,06/Nov/24 12:00 AM,13,Sprint 6,"As a developer, I need to optimize sandbox environment to improve performance.",api
ACME-1017,Build keyboard shortcuts,Story,Done,Highest,Eva Moreau,Sophie Renard,10/Nov/24 12:00 AM,11/Nov/24 12:00 AM,11/Nov/24 12:00 AM,2,Sprint 5,"As an admin, I want to build keyboard shortcuts to improve the team workflow.",performance
ACME-1018,Refactor GraphQL schema,Story,Done,Highest,Eva Moreau,David Chen,20/Nov/24 12:00 AM,23/Nov/24 12:00 AM,23/Nov/24 12:00 AM,3,Sprint 6,"As a developer, I need to refactor GraphQL schema to maintain code quality.",security
ACME-1019,Implement custom metrics dashboard,Story,To Do,High,Eva Moreau,Marc Dubois,02/Nov/24 12:00 AM,04/Nov/24 12:00 AM,,13,Sprint 5,"As a developer, I need to implement custom metrics dashboard to improve scalability.",ui
ACME-1020,Configure Kubernetes autoscaling,Story,Done,High,Eva Moreau,Sophie Renard,14/Nov/24 12:00 AM,15/Nov/24 12:00 AM,15/Nov/24 12:00 AM,5,Sprint 6,"As a developer, I need to configure Kubernetes autoscaling for better reliability.",infra
ACME-1021,Build sandbox environment,Story,Done,High,Eva Moreau,Sophie Renard,14/Nov/24 12:00 AM,15/Nov/24 12:00 AM,15/Nov/24 12:00 AM,5,Sprint 5,"As an admin, I want to build sandbox environment to improve the team workflow.",ux
ACME-1022,Optimize dark mode toggle,Story,Done,High,Eva Moreau,Marc Dubois,10/Nov/24 12:00 AM,13/Nov/24 12:00 AM,13/Nov/24 12:00 AM,13,Sprint 6,"As a developer, I need to optimize dark mode toggle to improve performance.",infra
ACME-1023,Add 2FA authentication,Story,Done,Medium,Eva Moreau,Marc Dubois,15/Nov/24 12:00 AM,16/Nov/24 12:00 AM,16/Nov/24 12:00 AM,8,Sprint 6,"As a user, I want to add 2FA authentication to get more value from the platform.",frontend
ACME-1024,Build responsive grid,Story,Done,High,Eva Moreau,David Chen,24/Nov/24 12:00 AM,25/Nov/24 12:00 AM,25/Nov/24 12:00 AM,8,Sprint 5,"As an admin, I want to build responsive grid to improve the team workflow.",infra
ACME-1025,Optimize health check endpoints,Story,To Do,Highest,Maxime Lefebvre,Alice Martin,14/Nov/24 12:00 AM,16/Nov/24 12:00 AM,,13,Sprint 5,"As a developer, I need to optimize health check endpoints to improve performance.",regression
ACME-1026,Build webhook retry logic,Story,In Progress,High,Maxime Lefebvre,Marc Dubois,27/Nov/24 12:00 AM,30/Nov/24 12:00 AM,,8,Sprint 6,"As an admin, I want to build webhook retry logic to improve the team workflow.",api
ACME-1027,Add user avatar upload,Story,Done,Low,Maxime Lefebvre,Marc Dubois,29/Nov/24 12:00 AM,02/Dec/24 12:00 AM,02/Dec/24 12:00 AM,5,Sprint 5,"As a user, I want to add user avatar upload to get more value from the platform.",ux
ACME-1028,Configure loading skeletons,Story,In Progress,Highest,Maxime Lefebvre,Sophie Renard,27/Nov/24 12:00 AM,30/Nov/24 12:00 AM,,1,Sprint 5,"As a developer, I need to configure loading skeletons for better reliability.",frontend
ACME-1029,Set up Prometheus metrics,Story,Done,Medium,Maxime Lefebvre,Alice Martin,27/Nov/24 12:00 AM,01/Dec/24 12:00 AM,01/Dec/24 12:00 AM,8,Sprint 6,"As a developer, I need to set up Prometheus metrics for operational readiness.",api
ACME-1030,Build feature flags,Story,Done,Medium,Maxime Lefebvre,Alice Martin,02/Nov/24 12:00 AM,03/Nov/24 12:00 AM,03/Nov/24 12:00 AM,1,Sprint 5,"As an admin, I want to build feature flags to improve the team workflow.",security
ACME-1031,Add Zapier integration,Story,Done,Medium,Maxime Lefebvre,Marc Dubois,14/Nov/24 12:00 AM,16/Nov/24 12:00 AM,16/Nov/24 12:00 AM,8,Sprint 5,"As a user, I want to add Zapier integration to get more value from the platform.",ui
ACME-1032,Build S3 presigned URLs,Story,Done,Highest,Maxime Lefebvre,Sophie Renard,20/Nov/24 12:00 AM,22/Nov/24 12:00 AM,22/Nov/24 12:00 AM,3,Sprint 5,"As an admin, I want to build S3 presigned URLs to improve the team workflow.",ux
ACME-1033,Configure session management,Story,Done,High,Maxime Lefebvre,Marc Dubois,26/Nov/24 12:00 AM,01/Dec/24 12:00 AM,01/Dec/24 12:00 AM,1,Sprint 5,"As a developer, I need to configure session management for better reliability.",ux
ACME-1034,Add referral tracking,Story,Done,Low,Ines Camus,David Chen,08/Nov/24 12:00 AM,09/Nov/24 12:00 AM,09/Nov/24 12:00 AM,5,Sprint 5,"As a user, I want to add referral tracking to get more value from the platform.",infra
ACME-1035,Migrate OAuth2 flow,Story,Done,Medium,Ines Camus,Sophie Renard,30/Nov/24 12:00 AM,03/Dec/24 12:00 AM,03/Dec/24 12:00 AM,1,Sprint 5,"As a developer, I need to migrate OAuth2 flow to reduce technical debt.",frontend
ACME-1036,Add infinite scroll,Story,Done,Medium,Ines Camus,David Chen,16/Nov/24 12:00 AM,18/Nov/24 12:00 AM,18/Nov/24 12:00 AM,5,Sprint 5,"As a user, I want to add infinite scroll to get more value from the platform.",bug
ACME-1037,Add Google OAuth,Story,Done,High,Ines Camus,Alice Martin,18/Nov/24 12:00 AM,19/Nov/24 12:00 AM,19/Nov/24 12:00 AM,2,Sprint 6,"As a user, I want to add Google OAuth to get more value from the platform.",frontend
ACME-1038,Migrate A/B testing framework,Story,Done,Highest,Ines Camus,Sophie Renard,13/Nov/24 12:00 AM,15/Nov/24 12:00 AM,15/Nov/24 12:00 AM,1,Sprint 6,"As a developer, I need to migrate A/B testing framework to reduce technical debt.",ui
ACME-1039,Build email templates,Story,Done,High,Ines Camus,David Chen,23/Nov/24 12:00 AM,25/Nov/24 12:00 AM,25/Nov/24 12:00 AM,8,Sprint 6,"As an admin, I want to build email templates to improve the team workflow.",performance
ACME-1040,Implement Stripe billing,Story,Done,High,Ines Camus,David Chen,13/Nov/24 12:00 AM,14/Nov/24 12:00 AM,14/Nov/24 12:00 AM,5,Sprint 6,"As a developer, I need to implement Stripe billing to improve scalability.",ui
ACME-1041,Configure multi-tenant isolation,Story,Done,High,Ines Camus,Marc Dubois,28/Nov/24 12:00 AM,30/Nov/24 12:00 AM,30/Nov/24 12:00 AM,2,Sprint 6,"As a developer, I need to configure multi-tenant isolation for better reliability.",reporting
ACME-1042,Loading skeletons not invalidated on update,Bug,Done,High,Ines Camus,Marc Dubois,04/Nov/24 12:00 AM,08/Nov/24 12:00 AM,08/Nov/24 12:00 AM,1,Sprint 5,**Bug:** loading skeletons not invalidated after update **Impact:** Stale data shown.,integration
ACME-1043,Integrate API gateway,Story,Done,Medium,Ines Camus,Sophie Renard,24/Nov/24 12:00 AM,29/Nov/24 12:00 AM,29/Nov/24 12:00 AM,2,Sprint 6,"As a user, I want to integrate API gateway so that workflows are automated.",security
ACME-1044,Migrate ML anomaly detection,Story,Done,High,Ines Camus,Sophie Renard,30/Nov/24 12:00 AM,01/Dec/24 12:00 AM,01/Dec/24 12:00 AM,8,Sprint 5,"As a developer, I need to migrate ML anomaly detection to reduce technical debt.",backend
ACME-1045,Set up embedding pipeline,Story,Done,High,Ines Camus,David Chen,08/Nov/24 12:00 AM,10/Nov/24 12:00 AM,10/Nov/24 12:00 AM,13,Sprint 6,"As a developer, I need to set up embedding pipeline for operational readiness.",infra
ACME-1046,Optimize embedding pipeline,Story,Done,High,Ines Camus,Marc Dubois,02/Nov/24 12:00 AM,06/Nov/24 12:00 AM,06/Nov/24 12:00 AM,5,Sprint 6,"As a developer, I need to optimize embedding pipeline to improve performance.",ux
ACME-1047,Optimize role badge system,Story,Done,High,Ines Camus,Marc Dubois,02/Nov/24 12:00 AM,03/Nov/24 12:00 AM,03/Nov/24 12:00 AM,8,Sprint 6,"As a developer, I need to optimize role badge system to improve performance.",backend
ACME-1048,S3 presigned urls not invalidated on update,Bug,Done,High,Sara Mercier,Sophie Renard,09/Nov/24 12:00 AM,11/Nov/24 12:00 AM,11/Nov/24 12:00 AM,1,Sprint 5,**Bug:** S3 presigned URLs not invalidated after update **Impact:** Stale data shown.,integration
ACME-1049,Dark mode toggle breaks on concurrent requests,Bug,Won't Do,Medium,Sara Mercier,Marc Dubois,18/Nov/24 12:00 AM,19/Nov/24 12:00 AM,,2,Sprint 5,**Bug:** dark mode toggle breaks under concurrent load **Impact:** Race condition in production.,bug
ACME-1050,Add model fine-tuning,Story,Done,Medium,Sara Mercier,Alice Martin,16/Nov/24 12:00 AM,21/Nov/24 12:00 AM,21/Nov/24 12:00 AM,13,Sprint 5,"As a user, I want to add model fine-tuning to get more value from the platform.",integration
ACME-1051,Integrate model fine-tuning,Story,Done,Low,Nicolas Michel,Sophie Renard,05/Nov/24 12:00 AM,06/Nov/24 12:00 AM,06/Nov/24 12:00 AM,1,Sprint 6,"As a user, I want to integrate model fine-tuning so that workflows are automated.",api
ACME-1052,Set up audit log viewer,Story,To Do,Medium,Nicolas Michel,Alice Martin,17/Nov/24 12:00 AM,18/Nov/24 12:00 AM,,8,Sprint 6,"As a developer, I need to set up audit log viewer for operational readiness.",regression
ACME-1053,Extend password reset flow,Story,Done,Low,Nicolas Michel,Alice Martin,04/Nov/24 12:00 AM,08/Nov/24 12:00 AM,08/Nov/24 12:00 AM,2,Sprint 5,"As a developer, I want to extend password reset flow to support new use cases.",security
ACME-1054,Optimize Google OAuth,Story,Done,Medium,Nicolas Michel,David Chen,15/Nov/24 12:00 AM,16/Nov/24 12:00 AM,16/Nov/24 12:00 AM,13,Sprint 5,"As a developer, I need to optimize Google OAuth to improve performance.",search
ACME-1055,Implement tenant provisioning,Story,In Progress,High,Nicolas Michel,Marc Dubois,06/Nov/24 12:00 AM,12/Nov/24 12:00 AM,,1,Sprint 5,"As a developer, I need to implement tenant provisioning to improve scalability.",security
ACME-1056,Refactor Google OAuth,Story,Done,Highest,Nicolas Michel,Alice Martin,02/Nov/24 12:00 AM,03/Nov/24 12:00 AM,03/Nov/24 12:00 AM,13,Sprint 6,"As a developer, I need to refactor Google OAuth to maintain code quality.",infra
ACME-1057,Set up vector database,Story,Done,High,Romain Roux,Alice Martin,16/Nov/24 12:00 AM,17/Nov/24 12:00 AM,17/Nov/24 12:00 AM,8,Sprint 5,"As a developer, I need to set up vector database for operational readiness.",reporting
ACME-1058,Implement WebSocket handler,Story,Done,High,Romain Roux,David Chen,08/Nov/24 12:00 AM,09/Nov/24 12:00 AM,09/Nov/24 12:00 AM,1,Sprint 6,"As a developer, I need to implement WebSocket handler to improve scalability.",ui
ACME-1059,Password reset flow returns wrong data,Bug,Done,Medium,Romain Roux,Marc Dubois,15/Nov/24 12:00 AM,16/Nov/24 12:00 AM,16/Nov/24 12:00 AM,8,Sprint 6,**Bug:** password reset flow returns incorrect data **Impact:** Data integrity issue.,ui
ACME-1060,Set up API gateway,Story,Done,High,Romain Roux,Marc Dubois,08/Nov/24 12:00 AM,09/Nov/24 12:00 AM,09/Nov/24 12:00 AM,2,Sprint 5,"As a developer, I need to set up API gateway for operational readiness.",search
ACME-1061,Migrate keyboard shortcuts,Story,To Do,High,Romain Roux,Alice Martin,21/Nov/24 12:00 AM,22/Nov/24 12:00 AM,,13,Sprint 5,"As a developer, I need to migrate keyboard shortcuts to reduce technical debt.",frontend
ACME-1062,Refactor public status page,Story,To Do,Medium,Romain Roux,Alice Martin,25/Nov/24 12:00 AM,26/Nov/24 12:00 AM,,8,Sprint 5,"As a developer, I need to refactor public status page to maintain code quality.",ux
ACME-1063,Refactor vector database,Story,Done,Medium,Romain Roux,David Chen,23/Nov/24 12:00 AM,24/Nov/24 12:00 AM,24/Nov/24 12:00 AM,5,Sprint 6,"As a developer, I need to refactor vector database to maintain code quality.",frontend
ACME-1064,Add changelog page,Story,Done,High,Romain Roux,Alice Martin,29/Nov/24 12:00 AM,30/Nov/24 12:00 AM,30/Nov/24 12:00 AM,13,Sprint 6,"As a user, I want to add changelog page to get more value from the platform.",ui
ACME-1065,Model fine-tuning memory leak detected,Bug,Done,High,Romain Roux,David Chen,05/Nov/24 12:00 AM,08/Nov/24 12:00 AM,08/Nov/24 12:00 AM,5,Sprint 5,**Bug:** memory leak in model fine-tuning **Impact:** Service degrades over time.,infra
ACME-1066,Set up Docker build,Story,Done,Medium,Romain Roux,Marc Dubois,01/Nov/24 12:00 AM,02/Nov/24 12:00 AM,02/Nov/24 12:00 AM,13,Sprint 6,"As a developer, I need to set up Docker build for operational readiness.",ux
ACME-1067,Set up referral tracking,Story,In Progress,Medium,Romain Roux,Sophie Renard,22/Nov/24 12:00 AM,24/Nov/24 12:00 AM,,13,Sprint 5,"As a developer, I need to set up referral tracking for operational readiness.",bug
ACME-1068,Add referral tracking,Story,Done,Low,Romain Roux,Sophie Renard,06/Nov/24 12:00 AM,07/Nov/24 12:00 AM,07/Nov/24 12:00 AM,1,Sprint 6,"As a user, I want to add referral tracking to get more value from the platform.",search
ACME-1069,Extend OAuth2 flow,Story,Done,High,Romain Roux,Marc Dubois,27/Nov/24 12:00 AM,30/Nov/24 12:00 AM,30/Nov/24 12:00 AM,1,Sprint 5,"As a developer, I want to extend OAuth2 flow to support new use cases.",infra
ACME-1070,Migrate public status page,Story,Done,Medium,Romain Roux,David Chen,29/Nov/24 12:00 AM,30/Nov/24 12:00 AM,30/Nov/24 12:00 AM,5,Sprint 6,"As a developer, I need to migrate public status page to reduce technical debt.",search
ACME-1071,Optimize webhook retry logic,Story,Done,Medium,Romain Roux,Alice Martin,08/Nov/24 12:00 AM,11/Nov/24 12:00 AM,11/Nov/24 12:00 AM,8,Sprint 6,"As a developer, I need to optimize webhook retry logic to improve performance.",performance
ACME-1072,Gdpr export returns wrong data,Bug,Done,Medium,Romain Roux,Alice Martin,12/Nov/24 12:00 AM,13/Nov/24 12:00 AM,13/Nov/24 12:00 AM,3,Sprint 5,**Bug:** GDPR export returns incorrect data **Impact:** Data integrity issue.,infra
ACME-1073,Extend webhook retry logic,Story,To Do,High,Romain Roux,Alice Martin,25/Nov/24 12:00 AM,26/Nov/24 12:00 AM,,13,Sprint 5,"As a developer, I want to extend webhook retry logic to support new use cases.",ux
ACME-1074,Implement cohort retention analysis,Story,Done,Medium,Romain Roux,David Chen,12/Nov/24 12:00 AM,13/Nov/24 12:00 AM,13/Nov/24 12:00 AM,13,Sprint 6,"As a developer, I need to implement cohort retention analysis to improve scalability.",regression
ACME-1075,Set up connection pooling,Story,Done,Highest,Romain Roux,Marc Dubois,01/Nov/24 12:00 AM,02/Nov/24 12:00 AM,02/Nov/24 12:00 AM,2,Sprint 5,"As a developer, I need to set up connection pooling for operational readiness.",ui
