Issue Key,Summary,Issue Type,Status,Priority,Assignee,Reporter,Created,Updated,Resolved,Story Points,Sprint,Description,Labels
ACME-1728,Build 2FA authentication,Story,Done,Medium,Simon Martin,Sophie Renard,03/Jan/25 12:00 AM,05/Jan/25 12:00 AM,05/Jan/25 12:00 AM,8,Sprint 9,"As an admin, I want to build 2FA authentication to improve the team workflow.",search
ACME-1729,Set up Zapier integration,Story,Done,Medium,Simon Martin,Sophie Renard,20/Jan/25 12:00 AM,21/Jan/25 12:00 AM,21/Jan/25 12:00 AM,1,Sprint 10,"As a developer, I need to set up Zapier integration for operational readiness.",frontend
ACME-1730,Configure session management,Story,In Progress,Low,Simon Martin,Alice Martin,15/Jan/25 12:00 AM,16/Jan/25 12:00 AM,,13,Sprint 9,"As a developer, I need to configure session management for better reliability.",security
ACME-1731,Configure user segment filters,Story,To Do,High,Simon Martin,Marc Dubois,01/Jan/25 12:00 AM,02/Jan/25 12:00 AM,,8,Sprint 10,"As a developer, I need to configure user segment filters for better reliability.",performance
ACME-1732,Build model fine-tuning,Story,Done,Highest,Simon Martin,David Chen,08/Jan/25 12:00 AM,11/Jan/25 12:00 AM,11/Jan/25 12:00 AM,3,Sprint 9,"As an admin, I want to build model fine-tuning to improve the team workflow.",security
ACME-1733,Add service account management,Story,Done,Medium,Simon Martin,David Chen,10/Jan/25 12:00 AM,13/Jan/25 12:00 AM,13/Jan/25 12:00 AM,13,Sprint 10,"As a user, I want to add service account management to get more value from the platform.",api
ACME-1734,Build OAuth2 flow,Story,Done,Low,Simon Martin,Sophie Renard,08/Jan/25 12:00 AM,09/Jan/25 12:00 AM,09/Jan/25 12:00 AM,2,Sprint 10,"As an admin, I want to build OAuth2 flow to improve the team workflow.",regression
ACME-1735,Google oauth crashes on null input,Bug,In Progress,Highest,Simon Martin,Marc Dubois,15/Jan/25 12:00 AM,19/Jan/25 12:00 AM,,8,Sprint 10,**Bug:** Google OAuth crashes when input is null **Impact:** Affects edge cases.,search
ACME-1736,Set up role badge system,Story,To Do,Medium,Simon Martin,Alice Martin,09/Jan/25 12:00 AM,10/Jan/25 12:00 AM,,8,Sprint 9,"As a developer, I need to set up role badge system for operational readiness.",ux
ACME-1737,Implement JWT middleware,Story,Won't Do,High,Simon Martin,Marc Dubois,19/Jan/25 12:00 AM,20/Jan/25 12:00 AM,,1,Sprint 9,"As a developer, I need to implement JWT middleware to improve scalability.",ux
ACME-1738,Set up A/B testing framework,Story,Done,Highest,Simon Martin,Alice Martin,14/Jan/25 12:00 AM,17/Jan/25 12:00 AM,17/Jan/25 12:00 AM,8,Sprint 9,"As a developer, I need to set up A/B testing framework for operational readiness.",reporting
ACME-1739,Extend Docker build,Story,Done,High,Simon Martin,Marc Dubois,20/Jan/25 12:00 AM,22/Jan/25 12:00 AM,22/Jan/25 12:00 AM,2,Sprint 9,"As a developer, I want to extend Docker build to support new use cases.",frontend
ACME-1740,Add data anonymization,Story,Done,High,Simon Martin,Alice Martin,23/Jan/25 12:00 AM,25/Jan/25 12:00 AM,25/Jan/25 12:00 AM,8,Sprint 10,"As a user, I want to add data anonymization to get more value from the platform.",search
ACME-1741,Extend data anonymization,Story,Done,Medium,Nadia Fernandez,Alice Martin,14/Jan/25 12:00 AM,15/Jan/25 12:00 AM,15/Jan/25 12:00 AM,8,Sprint 9,"As a developer, I want to extend data anonymization to support new use cases.",regression
ACME-1742,Add data anonymization,Story,Won't Do,Low,Nadia Fernandez,Marc Dubois,18/Jan/25 12:00 AM,19/Jan/25 12:00 AM,,13,Sprint 10,"As a user, I want to add data anonymization to get more value from the platform.",backend
ACME-1743,Multi-tenant isolation returns wrong data,Bug,Done,High,Nadia Fernandez,Alice Martin,11/Jan/25 12:00 AM,12/Jan/25 12:00 AM,12/Jan/25 12:00 AM,8,Sprint 9,**Bug:** multi-tenant isolation returns incorrect data **Impact:** Data integrity issue.,infra
ACME-1744,Migrate custom webhook builder,Story,In Progress,Medium,Nadia Fernandez,Marc Dubois,07/Jan/25 12:00 AM,09/Jan/25 12:00 AM,,13,Sprint 9,"As a developer, I need to migrate custom webhook builder to reduce technical debt.",reporting
ACME-1745,Optimize infinite scroll,Story,Done,Medium,Nadia Fernandez,Alice Martin,02/Jan/25 12:00 AM,06/Jan/25 12:00 AM,06/Jan/25 12:00 AM,3,Sprint 10,"As a developer, I need to optimize infinite scroll to improve performance.",api
ACME-1746,Extend role badge system,Story,To Do,High,Nadia Fernandez,David Chen,23/Jan/25 12:00 AM,27/Jan/25 12:00 AM,,5,Sprint 10,"As a developer, I want to extend role badge system to support new use cases.",ui
ACME-1747,Optimize 2FA authentication,Story,Done,Medium,Nadia Fernandez,David Chen,31/Jan/25 12:00 AM,02/Feb/25 12:00 AM,02/Feb/25 12:00 AM,5,Sprint 9,"As a developer, I need to optimize 2FA authentication to improve performance.",backend
ACME-1748,Configure tenant provisioning,Story,Done,Medium,Nadia Fernandez,Sophie Renard,21/Jan/25 12:00 AM,23/Jan/25 12:00 AM,23/Jan/25 12:00 AM,2,Sprint 10,"As a developer, I need to configure tenant provisioning for better reliability.",regression
ACME-1749,Configure service account management,Story,Done,High,Nadia Fernandez,Sophie Renard,28/Jan/25 12:00 AM,31/Jan/25 12:00 AM,31/Jan/25 12:00 AM,13,Sprint 10,"As a developer, I need to configure service account management for better reliability.",ui
ACME-1750,Data anonymization fails silently,Bug,Done,Medium,Nadia Fernandez,Sophie Renard,22/Jan/25 12:00 AM,24/Jan/25 12:00 AM,24/Jan/25 12:00 AM,3,Sprint 9,**Bug:** data anonymization fails silently **Impact:** Affects users in production.,ui
ACME-1751,Refactor custom metrics dashboard,Story,Done,High,Nadia Fernandez,David Chen,09/Jan/25 12:00 AM,12/Jan/25 12:00 AM,12/Jan/25 12:00 AM,1,Sprint 9,"As a developer, I need to refactor custom metrics dashboard to maintain code quality.",performance
ACME-1752,Team activity feed fails silently,Bug,To Do,Low,Nadia Fernandez,Alice Martin,19/Jan/25 12:00 AM,22/Jan/25 12:00 AM,,1,Sprint 9,**Bug:** team activity feed fails silently **Impact:** Affects users in production.,performance
ACME-1753,Implement role badge system,Story,Done,High,Pierre Okafor,Alice Martin,22/Jan/25 12:00 AM,24/Jan/25 12:00 AM,24/Jan/25 12:00 AM,2,Sprint 9,"As a developer, I need to implement role badge system to improve scalability.",ui
ACME-1754,Extend email templates,Story,Done,High,Pierre Okafor,Alice Martin,20/Jan/25 12:00 AM,26/Jan/25 12:00 AM,26/Jan/25 12:00 AM,3,Sprint 10,"As a developer, I want to extend email templates to support new use cases.",ux
ACME-1755,Ml anomaly detection timeout on large payload,Bug,Done,High,Pierre Okafor,Marc Dubois,15/Jan/25 12:00 AM,17/Jan/25 12:00 AM,17/Jan/25 12:00 AM,1,Sprint 9,**Bug:** ML anomaly detection times out on large payloads **Impact:** Affects power users.,regression
ACME-1756,Optimize Docker build,Story,To Do,Low,Pierre Okafor,Sophie Renard,26/Jan/25 12:00 AM,28/Jan/25 12:00 AM,,3,Sprint 9,"As a developer, I need to optimize Docker build to improve performance.",search
ACME-1757,Refactor Kubernetes autoscaling,Story,Done,Medium,Pierre Okafor,David Chen,05/Jan/25 12:00 AM,06/Jan/25 12:00 AM,06/Jan/25 12:00 AM,2,Sprint 9,"As a developer, I need to refactor Kubernetes autoscaling to maintain code quality.",bug
ACME-1758,Migrate vector database,Story,Won't Fix,Medium,Pierre Okafor,Alice Martin,14/Jan/25 12:00 AM,17/Jan/25 12:00 AM,,5,Sprint 9,"As a developer, I need to migrate vector database to reduce technical debt.",frontend
ACME-1759,Implement password reset flow,Story,Done,Low,Pierre Okafor,Sophie Renard,09/Jan/25 12:00 AM,11/Jan/25 12:00 AM,11/Jan/25 12:00 AM,3,Sprint 10,"As a developer, I need to implement password reset flow to improve scalability.",ui
ACME-1760,Integrate drag-and-drop builder,Story,Done,High,Pierre Okafor,David Chen,30/Jan/25 12:00 AM,01/Feb/25 12:00 AM,01/Feb/25 12:00 AM,8,Sprint 9,"As a user, I want to integrate drag-and-drop builder so that workflows are automated.",frontend
ACME-1761,Configure database migrations,Story,Done,Highest,Pierre Okafor,Sophie Renard,06/Jan/25 12:00 AM,09/Jan/25 12:00 AM,09/Jan/25 12:00 AM,13,Sprint 9,"As a developer, I need to configure database migrations for better reliability.",frontend
ACME-1762,Implement referral tracking,Story,Done,High,Pierre Okafor,Marc Dubois,20/Jan/25 12:00 AM,22/Jan/25 12:00 AM,22/Jan/25 12:00 AM,3,Sprint 9,"As a developer, I need to implement referral tracking to improve scalability.",performance
ACME-1763,Recommendation engine not invalidated on update,Bug,Done,Highest,Pierre Okafor,Alice Martin,01/Jan/25 12:00 AM,03/Jan/25 12:00 AM,03/Jan/25 12:00 AM,5,Sprint 9,**Bug:** recommendation engine not invalidated after update **Impact:** Stale data shown.,infra
ACME-1764,Integrate 2FA authentication,Story,Done,High,Laure Fontaine,Sophie Renard,22/Jan/25 12:00 AM,23/Jan/25 12:00 AM,23/Jan/25 12:00 AM,13,Sprint 10,"As a user, I want to integrate 2FA authentication so that workflows are automated.",bug
ACME-1765,Migrate lazy image loading,Story,Done,High,Laure Fontaine,Alice Martin,30/Jan/25 12:00 AM,31/Jan/25 12:00 AM,31/Jan/25 12:00 AM,5,Sprint 10,"As a developer, I need to migrate lazy image loading to reduce technical debt.",api
ACME-1766,Add session management,Story,In Progress,High,Laure Fontaine,Marc Dubois,07/Jan/25 12:00 AM,08/Jan/25 12:00 AM,,1,Sprint 10,"As a user, I want to add session management to get more value from the platform.",ui
ACME-1767,Refactor report PDF export,Story,Done,Medium,Laure Fontaine,David Chen,21/Jan/25 12:00 AM,22/Jan/25 12:00 AM,22/Jan/25 12:00 AM,1,Sprint 9,"As a developer, I need to refactor report PDF export to maintain code quality.",ui
ACME-1768,Integrate ELK log aggregation,Story,Done,High,Laure Fontaine,David Chen,16/Jan/25 12:00 AM,17/Jan/25 12:00 AM,17/Jan/25 12:00 AM,2,Sprint 10,"As a user, I want to integrate ELK log aggregation so that workflows are automated.",ux
ACME-1769,Set up Salesforce connector,Story,Done,Highest,Laure Fontaine,David Chen,23/Jan/25 12:00 AM,24/Jan/25 12:00 AM,24/Jan/25 12:00 AM,13,Sprint 9,"As a developer, I need to set up Salesforce connector for operational readiness.",ux
ACME-1770,Implement search autocomplete,Story,Done,High,Laure Fontaine,Alice Martin,21/Jan/25 12:00 AM,22/Jan/25 12:00 AM,22/Jan/25 12:00 AM,5,Sprint 10,"As a developer, I need to implement search autocomplete to improve scalability.",ui
ACME-1771,Onboarding checklist not invalidated on update,Bug,Done,High,Laure Fontaine,David Chen,09/Jan/25 12:00 AM,12/Jan/25 12:00 AM,12/Jan/25 12:00 AM,3,Sprint 10,**Bug:** onboarding checklist not invalidated after update **Impact:** Stale data shown.,integration
ACME-1772,Implement cohort retention analysis,Story,Done,Medium,Laure Fontaine,Alice Martin,03/Jan/25 12:00 AM,05/Jan/25 12:00 AM,05/Jan/25 12:00 AM,5,Sprint 10,"As a developer, I need to implement cohort retention analysis to improve scalability.",reporting
ACME-1773,Add webhook retry logic,Story,Done,High,Laure Fontaine,Alice Martin,23/Jan/25 12:00 AM,24/Jan/25 12:00 AM,24/Jan/25 12:00 AM,5,Sprint 9,"As a user, I want to add webhook retry logic to get more value from the platform.",ux
ACME-1774,Configure data export scheduler,Story,Done,Medium,Laure Fontaine,Sophie Renard,04/Jan/25 12:00 AM,05/Jan/25 12:00 AM,05/Jan/25 12:00 AM,2,Sprint 10,"As a developer, I need to configure data export scheduler for better reliability.",regression
ACME-1775,Optimize public status page,Story,Done,High,Laure Fontaine,Sophie Renard,01/Jan/25 12:00 AM,06/Jan/25 12:00 AM,06/Jan/25 12:00 AM,3,Sprint 9,"As a developer, I need to optimize public status page to improve performance.",performance
ACME-1776,Refactor WebSocket handler,Story,To Do,High,Laure Fontaine,David Chen,02/Jan/25 12:00 AM,04/Jan/25 12:00 AM,,8,Sprint 10,"As a developer, I need to refactor WebSocket handler to maintain code quality.",search
ACME-1777,Implement CQRS pattern,Story,Done,High,Laure Fontaine,Alice Martin,24/Jan/25 12:00 AM,26/Jan/25 12:00 AM,26/Jan/25 12:00 AM,5,Sprint 9,"As a developer, I need to implement CQRS pattern to improve scalability.",security
ACME-1778,Set up onboarding checklist,Story,Done,Low,Laure Fontaine,David Chen,07/Jan/25 12:00 AM,08/Jan/25 12:00 AM,08/Jan/25 12:00 AM,8,Sprint 10,"As a developer, I need to set up onboarding checklist for operational readiness.",regression
ACME-1779,Extend Zapier integration,Story,Done,High,Laure Fontaine,Sophie Renard,23/Jan/25 12:00 AM,25/Jan/25 12:00 AM,25/Jan/25 12:00 AM,13,Sprint 10,"As a developer, I want to extend Zapier integration to support new use cases.",search
ACME-1780,Add Terraform modules,Story,Done,High,Laure Fontaine,Marc Dubois,22/Jan/25 12:00 AM,23/Jan/25 12:00 AM,23/Jan/25 12:00 AM,5,Sprint 10,"As a user, I want to add Terraform modules to get more value from the platform.",api
ACME-1781,Refactor recommendation engine,Story,Done,Medium,Laure Fontaine,David Chen,11/Jan/25 12:00 AM,14/Jan/25 12:00 AM,14/Jan/25 12:00 AM,2,Sprint 10,"As a developer, I need to refactor recommendation engine to maintain code quality.",regression
ACME-1782,Migrate saved filter presets,Story,Done,Highest,Laure Fontaine,David Chen,10/Jan/25 12:00 AM,11/Jan/25 12:00 AM,11/Jan/25 12:00 AM,8,Sprint 10,"As a developer, I need to migrate saved filter presets to reduce technical debt.",bug
ACME-1783,Extend drag-and-drop builder,Story,Done,High,Jade Faure,David Chen,06/Jan/25 12:00 AM,11/Jan/25 12:00 AM,11/Jan/25 12:00 AM,8,Sprint 10,"As a developer, I want to extend drag-and-drop builder to support new use cases.",regression
ACME-1784,Implement user feedback widget,Story,Done,High,Jade Faure,Alice Martin,29/Jan/25 12:00 AM,30/Jan/25 12:00 AM,30/Jan/25 12:00 AM,1,Sprint 9,"As a developer, I need to implement user feedback widget to improve scalability.",integration
ACME-1785,Build health check endpoints,Story,Done,High,Jade Faure,Sophie Renard,24/Jan/25 12:00 AM,26/Jan/25 12:00 AM,26/Jan/25 12:00 AM,8,Sprint 9,"As an admin, I want to build health check endpoints to improve the team workflow.",search
ACME-1786,Add connection pooling,Story,Done,High,Jade Faure,Sophie Renard,13/Jan/25 12:00 AM,14/Jan/25 12:00 AM,14/Jan/25 12:00 AM,2,Sprint 9,"As a user, I want to add connection pooling to get more value from the platform.",backend
ACME-1787,Refactor SSO integration,Story,Done,Low,Jade Faure,Sophie Renard,09/Jan/25 12:00 AM,12/Jan/25 12:00 AM,12/Jan/25 12:00 AM,8,Sprint 10,"As a developer, I need to refactor SSO integration to maintain code quality.",performance
ACME-1788,Set up feature flags,Story,Done,High,Jade Faure,David Chen,29/Jan/25 12:00 AM,31/Jan/25 12:00 AM,31/Jan/25 12:00 AM,3,Sprint 10,"As a developer, I need to set up feature flags for operational readiness.",api
ACME-1789,Integrate team activity feed,Story,Done,Medium,Jade Faure,David Chen,05/Jan/25 12:00 AM,06/Jan/25 12:00 AM,06/Jan/25 12:00 AM,3,Sprint 10,"As a user, I want to integrate team activity feed so that workflows are automated.",frontend
ACME-1790,Integrate tenant provisioning,Story,Done,High,Jade Faure,Sophie Renard,23/Jan/25 12:00 AM,24/Jan/25 12:00 AM,24/Jan/25 12:00 AM,1,Sprint 9,"As a user, I want to integrate tenant provisioning so that workflows are automated.",performance
ACME-1791,Set up Google OAuth,Story,Done,High,Jade Faure,Alice Martin,16/Jan/25 12:00 AM,19/Jan/25 12:00 AM,19/Jan/25 12:00 AM,1,Sprint 9,"As a developer, I need to set up Google OAuth for operational readiness.",regression
ACME-1792,Extend OAuth2 flow,Story,Done,Low,Jade Faure,Alice Martin,29/Jan/25 12:00 AM,30/Jan/25 12:00 AM,30/Jan/25 12:00 AM,2,Sprint 10,"As a developer, I want to extend OAuth2 flow to support new use cases.",backend
ACME-1793,Migrate Redis cache,Story,To Do,Low,Jade Faure,Alice Martin,29/Jan/25 12:00 AM,30/Jan/25 12:00 AM,,13,Sprint 9,"As a developer, I need to migrate Redis cache to reduce technical debt.",backend
ACME-1794,Implement responsive grid,Story,Done,High,Jade Faure,Sophie Renard,19/Jan/25 12:00 AM,22/Jan/25 12:00 AM,22/Jan/25 12:00 AM,5,Sprint 10,"As a developer, I need to implement responsive grid to improve scalability.",frontend
ACME-1795,Extend multi-tenant isolation,Story,Done,Low,Jade Faure,David Chen,31/Jan/25 12:00 AM,03/Feb/25 12:00 AM,03/Feb/25 12:00 AM,2,Sprint 10,"As a developer, I want to extend multi-tenant isolation to support new use cases.",frontend
ACME-1796,Extend user segment filters,Story,Done,Medium,Victor Durand,Marc Dubois,20/Jan/25 12:00 AM,22/Jan/25 12:00 AM,22/Jan/25 12:00 AM,5,Sprint 10,"As a developer, I want to extend user segment filters to support new use cases.",security
ACME-1797,Migrate service account management,Story,Done,Medium,Victor Durand,Marc Dubois,05/Jan/25 12:00 AM,06/Jan/25 12:00 AM,06/Jan/25 12:00 AM,1,Sprint 9,"As a developer, I need to migrate service account management to reduce technical debt.",search
ACME-1798,Optimize Salesforce connector,Story,Done,Medium,Victor Durand,David Chen,30/Jan/25 12:00 AM,04/Feb/25 12:00 AM,04/Feb/25 12:00 AM,8,Sprint 9,"As a developer, I need to optimize Salesforce connector to improve performance.",integration
ACME-1799,Refactor role badge system,Story,Done,Medium,Victor Durand,Marc Dubois,11/Jan/25 12:00 AM,15/Jan/25 12:00 AM,15/Jan/25 12:00 AM,3,Sprint 10,"As a developer, I need to refactor role badge system to maintain code quality.",regression
ACME-1800,Set up service account management,Story,Done,High,Victor Durand,David Chen,07/Jan/25 12:00 AM,10/Jan/25 12:00 AM,10/Jan/25 12:00 AM,13,Sprint 10,"As a developer, I need to set up service account management for operational readiness.",infra
ACME-1801,Terraform modules memory leak detected,Bug,Done,High,Victor Durand,Alice Martin,07/Jan/25 12:00 AM,08/Jan/25 12:00 AM,08/Jan/25 12:00 AM,8,Sprint 10,**Bug:** memory leak in Terraform modules **Impact:** Service degrades over time.,search
ACME-1802,Kubernetes autoscaling memory leak detected,Bug,Done,Medium,Victor Durand,Marc Dubois,30/Jan/25 12:00 AM,31/Jan/25 12:00 AM,31/Jan/25 12:00 AM,2,Sprint 9,**Bug:** memory leak in Kubernetes autoscaling **Impact:** Service degrades over time.,frontend
ACME-1803,Extend cohort retention analysis,Story,In Progress,High,Victor Durand,Alice Martin,09/Jan/25 12:00 AM,12/Jan/25 12:00 AM,,2,Sprint 9,"As a developer, I want to extend cohort retention analysis to support new use cases.",api
ACME-1804,Add webhook retry logic,Story,Done,High,Victor Durand,Alice Martin,31/Jan/25 12:00 AM,02/Feb/25 12:00 AM,02/Feb/25 12:00 AM,3,Sprint 10,"As a user, I want to add webhook retry logic to get more value from the platform.",performance
ACME-1805,Implement email templates,Story,Won't Do,High,Victor Durand,Sophie Renard,07/Jan/25 12:00 AM,08/Jan/25 12:00 AM,,5,Sprint 10,"As a developer, I need to implement email templates to improve scalability.",backend
ACME-1806,Configure model fine-tuning,Story,To Do,High,Antoine Petit,David Chen,05/Jan/25 12:00 AM,08/Jan/25 12:00 AM,,5,Sprint 10,"As a developer, I need to configure model fine-tuning for better reliability.",integration
ACME-1807,Refactor webhook retry logic,Story,Done,High,Antoine Petit,Alice Martin,26/Jan/25 12:00 AM,29/Jan/25 12:00 AM,29/Jan/25 12:00 AM,8,Sprint 10,"As a developer, I need to refactor webhook retry logic to maintain code quality.",bug
ACME-1808,Zapier integration fails silently,Bug,Done,Low,Antoine Petit,Marc Dubois,18/Jan/25 12:00 AM,19/Jan/25 12:00 AM,19/Jan/25 12:00 AM,2,Sprint 10,**Bug:** Zapier integration fails silently **Impact:** Affects users in production.,security
ACME-1809,Optimize CI pipeline,Story,To Do,Medium,Antoine Petit,Sophie Renard,08/Jan/25 12:00 AM,12/Jan/25 12:00 AM,,1,Sprint 9,"As a developer, I need to optimize CI pipeline to improve performance.",integration
ACME-1810,Docker build timeout on large payload,Bug,In Progress,High,Antoine Petit,Sophie Renard,06/Jan/25 12:00 AM,07/Jan/25 12:00 AM,,8,Sprint 9,**Bug:** Docker build times out on large payloads **Impact:** Affects power users.,bug
ACME-1811,Rag pipeline returns wrong data,Bug,Done,Medium,Antoine Petit,David Chen,29/Jan/25 12:00 AM,01/Feb/25 12:00 AM,01/Feb/25 12:00 AM,3,Sprint 9,**Bug:** RAG pipeline returns incorrect data **Impact:** Data integrity issue.,frontend
ACME-1812,Integrate multi-tenant isolation,Story,Done,Medium,Antoine Petit,Marc Dubois,13/Jan/25 12:00 AM,19/Jan/25 12:00 AM,19/Jan/25 12:00 AM,13,Sprint 9,"As a user, I want to integrate multi-tenant isolation so that workflows are automated.",ux
ACME-1813,Audit log viewer timeout on large payload,Bug,Done,Medium,Antoine Petit,David Chen,01/Jan/25 12:00 AM,03/Jan/25 12:00 AM,03/Jan/25 12:00 AM,8,Sprint 10,**Bug:** audit log viewer times out on large payloads **Impact:** Affects power users.,integration
ACME-1814,Configure embedding pipeline,Story,Done,High,Antoine Petit,Alice Martin,28/Jan/25 12:00 AM,31/Jan/25 12:00 AM,31/Jan/25 12:00 AM,13,Sprint 9,"As a developer, I need to configure embedding pipeline for better reliability.",integration
ACME-1815,Add lazy image loading,Story,Done,Highest,Hugo Dubois,Sophie Renard,03/Jan/25 12:00 AM,06/Jan/25 12:00 AM,06/Jan/25 12:00 AM,13,Sprint 10,"As a user, I want to add lazy image loading to get more value from the platform.",regression
ACME-1816,Api gateway returns wrong data,Bug,Done,Low,Hugo Dubois,Marc Dubois,23/Jan/25 12:00 AM,25/Jan/25 12:00 AM,25/Jan/25 12:00 AM,2,Sprint 9,**Bug:** API gateway returns incorrect data **Impact:** Data integrity issue.,regression
ACME-1817,Zapier integration breaks on concurrent requests,Bug,Done,Medium,Hugo Dubois,Sophie Renard,21/Jan/25 12:00 AM,25/Jan/25 12:00 AM,25/Jan/25 12:00 AM,8,Sprint 9,**Bug:** Zapier integration breaks under concurrent load **Impact:** Race condition in production.,api
ACME-1818,Dark mode toggle memory leak detected,Bug,Done,Medium,Hugo Dubois,Alice Martin,25/Jan/25 12:00 AM,28/Jan/25 12:00 AM,28/Jan/25 12:00 AM,8,Sprint 10,**Bug:** memory leak in dark mode toggle **Impact:** Service degrades over time.,integration
ACME-1819,Recommendation engine not invalidated on update,Bug,Done,High,Hugo Dubois,Alice Martin,20/Jan/25 12:00 AM,22/Jan/25 12:00 AM,22/Jan/25 12:00 AM,2,Sprint 9,**Bug:** recommendation engine not invalidated after update **Impact:** Stale data shown.,performance
ACME-1820,Elk log aggregation fails silently,Bug,Done,High,Hugo Dubois,Alice Martin,18/Jan/25 12:00 AM,22/Jan/25 12:00 AM,22/Jan/25 12:00 AM,3,Sprint 9,**Bug:** ELK log aggregation fails silently **Impact:** Affects users in production.,bug
ACME-1821,Refactor sandbox environment,Story,Done,Low,Hugo Dubois,Alice Martin,01/Jan/25 12:00 AM,04/Jan/25 12:00 AM,04/Jan/25 12:00 AM,3,Sprint 10,"As a developer, I need to refactor sandbox environment to maintain code quality.",performance
ACME-1822,Set up CSV bulk import,Story,Done,High,Hugo Dubois,Marc Dubois,06/Jan/25 12:00 AM,08/Jan/25 12:00 AM,08/Jan/25 12:00 AM,1,Sprint 10,"As a developer, I need to set up CSV bulk import for operational readiness.",ui
ACME-1823,Configure recommendation engine,Story,Done,Medium,Remy Dupuis,Sophie Renard,25/Jan/25 12:00 AM,27/Jan/25 12:00 AM,27/Jan/25 12:00 AM,5,Sprint 10,"As a developer, I need to configure recommendation engine for better reliability.",backend
ACME-1824,Implement sandbox environment,Story,In Progress,High,Remy Dupuis,Marc Dubois,21/Jan/25 12:00 AM,23/Jan/25 12:00 AM,,13,Sprint 9,"As a developer, I need to implement sandbox environment to improve scalability.",bug
ACME-1825,Integrate Salesforce connector,Story,Done,Medium,Remy Dupuis,David Chen,24/Jan/25 12:00 AM,26/Jan/25 12:00 AM,26/Jan/25 12:00 AM,3,Sprint 10,"As a user, I want to integrate Salesforce connector so that workflows are automated.",api
ACME-1826,Extend embedding pipeline,Story,Done,High,Remy Dupuis,David Chen,25/Jan/25 12:00 AM,29/Jan/25 12:00 AM,29/Jan/25 12:00 AM,3,Sprint 10,"As a developer, I want to extend embedding pipeline to support new use cases.",search
ACME-1827,Set up cohort retention analysis,Story,Done,Highest,Remy Dupuis,Marc Dubois,18/Jan/25 12:00 AM,19/Jan/25 12:00 AM,19/Jan/25 12:00 AM,3,Sprint 10,"As a developer, I need to set up cohort retention analysis for operational readiness.",reporting
ACME-1828,Set up loading skeletons,Story,In Progress,Low,Remy Dupuis,Marc Dubois,05/Jan/25 12:00 AM,06/Jan/25 12:00 AM,,2,Sprint 10,"As a developer, I need to set up loading skeletons for operational readiness.",infra
ACME-1829,Configure drag-and-drop builder,Story,Done,Highest,Remy Dupuis,Alice Martin,25/Jan/25 12:00 AM,26/Jan/25 12:00 AM,26/Jan/25 12:00 AM,3,Sprint 9,"As a developer, I need to configure drag-and-drop builder for better reliability.",backend
ACME-1830,Build health check endpoints,Story,Done,Highest,Remy Dupuis,David Chen,21/Jan/25 12:00 AM,22/Jan/25 12:00 AM,22/Jan/25 12:00 AM,1,Sprint 10,"As an admin, I want to build health check endpoints to improve the team workflow.",reporting
ACME-1831,Add Prometheus metrics,Story,Done,Low,Remy Dupuis,Marc Dubois,10/Jan/25 12:00 AM,11/Jan/25 12:00 AM,11/Jan/25 12:00 AM,1,Sprint 10,"As a user, I want to add Prometheus metrics to get more value from the platform.",reporting
ACME-1832,Integrate database migrations,Story,Done,High,Remy Dupuis,Marc Dubois,12/Jan/25 12:00 AM,13/Jan/25 12:00 AM,13/Jan/25 12:00 AM,5,Sprint 9,"As a user, I want to integrate database migrations so that workflows are automated.",frontend
ACME-1833,Extend ELK log aggregation,Story,Done,High,Remy Dupuis,Sophie Renard,06/Jan/25 12:00 AM,08/Jan/25 12:00 AM,08/Jan/25 12:00 AM,3,Sprint 10,"As a developer, I want to extend ELK log aggregation to support new use cases.",performance
ACME-1834,Team activity feed not invalidated on update,Bug,Done,Low,Remy Dupuis,Alice Martin,04/Jan/25 12:00 AM,06/Jan/25 12:00 AM,06/Jan/25 12:00 AM,1,Sprint 10,**Bug:** team activity feed not invalidated after update **Impact:** Stale data shown.,ux
ACME-1835,Extend Slack notifications,Story,Done,High,Remy Dupuis,David Chen,25/Jan/25 12:00 AM,28/Jan/25 12:00 AM,28/Jan/25 12:00 AM,3,Sprint 10,"As a developer, I want to extend Slack notifications to support new use cases.",bug
