Issue Key,Summary,Issue Type,Status,Priority,Assignee,Reporter,Created,Updated,Resolved,Story Points,Sprint,Description,Labels
ACME-2486,Set up infinite scroll,Story,Done,High,Lucas Renard,David Chen,20/Feb/25 12:00 AM,23/Feb/25 12:00 AM,23/Feb/25 12:00 AM,2,Sprint 12,"As a developer, I need to set up infinite scroll for operational readiness.",performance
ACME-2487,Oauth2 flow fails silently,Bug,Won't Do,High,Lucas Renard,Marc Dubois,22/Feb/25 12:00 AM,25/Feb/25 12:00 AM,,1,Sprint 11,**Bug:** OAuth2 flow fails silently **Impact:** Affects users in production.,bug
ACME-2488,Extend Slack notifications,Story,Done,Medium,Lucas Renard,Alice Martin,03/Feb/25 12:00 AM,04/Feb/25 12:00 AM,04/Feb/25 12:00 AM,13,Sprint 11,"As a developer, I want to extend Slack notifications to support new use cases.",performance
ACME-2489,Build connection pooling,Story,Done,Medium,Lucas Renard,David Chen,11/Feb/25 12:00 AM,13/Feb/25 12:00 AM,13/Feb/25 12:00 AM,2,Sprint 12,"As an admin, I want to build connection pooling to improve the team workflow.",reporting
ACME-2490,Refactor audit log viewer,Story,Won't Fix,Highest,Lucas Renard,David Chen,14/Feb/25 12:00 AM,16/Feb/25 12:00 AM,,13,Sprint 12,"As a developer, I need to refactor audit log viewer to maintain code quality.",integration
ACME-2491,Configure Zapier integration,Story,Done,Medium,Lucas Renard,Marc Dubois,04/Feb/25 12:00 AM,06/Feb/25 12:00 AM,06/Feb/25 12:00 AM,5,Sprint 11,"As a developer, I need to configure Zapier integration for better reliability.",ux
ACME-2492,Build GDPR export,Story,In Progress,Medium,Lucas Renard,Sophie Renard,23/Feb/25 12:00 AM,24/Feb/25 12:00 AM,,8,Sprint 12,"As an admin, I want to build GDPR export to improve the team workflow.",infra
ACME-2493,Event sourcing memory leak detected,Bug,Done,Medium,Lucas Renard,David Chen,14/Feb/25 12:00 AM,17/Feb/25 12:00 AM,17/Feb/25 12:00 AM,5,Sprint 12,**Bug:** memory leak in event sourcing **Impact:** Service degrades over time.,ui
ACME-2494,Set up Slack notifications,Story,Done,Highest,Lucas Renard,Marc Dubois,04/Feb/25 12:00 AM,09/Feb/25 12:00 AM,09/Feb/25 12:00 AM,8,Sprint 11,"As a developer, I need to set up Slack notifications for operational readiness.",reporting
ACME-2495,Refactor AI gateway,Story,Won't Fix,High,Lucas Renard,Alice Martin,24/Feb/25 12:00 AM,26/Feb/25 12:00 AM,,3,Sprint 11,"As a developer, I need to refactor AI gateway to maintain code quality.",ux
ACME-2496,Migrate Zapier integration,Story,In Progress,High,Lucas Renard,Alice Martin,05/Feb/25 12:00 AM,08/Feb/25 12:00 AM,,1,Sprint 12,"As a developer, I need to migrate Zapier integration to reduce technical debt.",infra
ACME-2497,Build referral tracking,Story,Done,High,Lucas Renard,David Chen,25/Feb/25 12:00 AM,27/Feb/25 12:00 AM,27/Feb/25 12:00 AM,1,Sprint 12,"As an admin, I want to build referral tracking to improve the team workflow.",reporting
ACME-2498,Migrate audit trail viewer,Story,Done,High,Lucas Renard,Sophie Renard,17/Feb/25 12:00 AM,18/Feb/25 12:00 AM,18/Feb/25 12:00 AM,1,Sprint 12,"As a developer, I need to migrate audit trail viewer to reduce technical debt.",search
ACME-2499,Set up sandbox environment,Story,Won't Fix,Medium,Zoe Laurent,Alice Martin,20/Feb/25 12:00 AM,24/Feb/25 12:00 AM,,1,Sprint 11,"As a developer, I need to set up sandbox environment for operational readiness.",ui
ACME-2500,Terraform modules breaks on concurrent requests,Bug,Done,High,Zoe Laurent,Sophie Renard,12/Feb/25 12:00 AM,16/Feb/25 12:00 AM,16/Feb/25 12:00 AM,3,Sprint 12,**Bug:** Terraform modules breaks under concurrent load **Impact:** Race condition in production.,integration
ACME-2501,Prometheus metrics returns wrong data,Bug,Done,Medium,Zoe Laurent,Alice Martin,16/Feb/25 12:00 AM,21/Feb/25 12:00 AM,21/Feb/25 12:00 AM,3,Sprint 12,**Bug:** Prometheus metrics returns incorrect data **Impact:** Data integrity issue.,bug
ACME-2502,Implement lazy image loading,Story,Done,Highest,Thomas Simon,David Chen,28/Feb/25 12:00 AM,04/Mar/25 12:00 AM,04/Mar/25 12:00 AM,5,Sprint 12,"As a developer, I need to implement lazy image loading to improve scalability.",api
ACME-2503,Optimize vector database,Story,Done,Medium,Thomas Simon,David Chen,11/Feb/25 12:00 AM,14/Feb/25 12:00 AM,14/Feb/25 12:00 AM,5,Sprint 11,"As a developer, I need to optimize vector database to improve performance.",ui
ACME-2504,Configure Docker build,Story,In Progress,Low,Thomas Simon,David Chen,28/Feb/25 12:00 AM,02/Mar/25 12:00 AM,,13,Sprint 11,"As a developer, I need to configure Docker build for better reliability.",ui
ACME-2505,Optimize model fine-tuning,Story,Done,High,Thomas Simon,David Chen,03/Feb/25 12:00 AM,04/Feb/25 12:00 AM,04/Feb/25 12:00 AM,2,Sprint 12,"As a developer, I need to optimize model fine-tuning to improve performance.",regression
ACME-2506,Optimize ML anomaly detection,Story,In Progress,Medium,Thomas Simon,Alice Martin,06/Feb/25 12:00 AM,07/Feb/25 12:00 AM,,5,Sprint 11,"As a developer, I need to optimize ML anomaly detection to improve performance.",integration
ACME-2507,Optimize onboarding checklist,Story,In Progress,Medium,Thomas Simon,David Chen,22/Feb/25 12:00 AM,24/Feb/25 12:00 AM,,5,Sprint 12,"As a developer, I need to optimize onboarding checklist to improve performance.",search
ACME-2508,Implement A/B testing framework,Story,Done,High,Thomas Simon,Marc Dubois,16/Feb/25 12:00 AM,19/Feb/25 12:00 AM,19/Feb/25 12:00 AM,3,Sprint 11,"As a developer, I need to implement A/B testing framework to improve scalability.",api
ACME-2509,Migrate RBAC permissions,Story,Done,Low,Thomas Simon,David Chen,18/Feb/25 12:00 AM,22/Feb/25 12:00 AM,22/Feb/25 12:00 AM,3,Sprint 12,"As a developer, I need to migrate RBAC permissions to reduce technical debt.",bug
ACME-2510,Migrate email templates,Story,Done,Highest,Thomas Simon,Alice Martin,17/Feb/25 12:00 AM,20/Feb/25 12:00 AM,20/Feb/25 12:00 AM,2,Sprint 12,"As a developer, I need to migrate email templates to reduce technical debt.",api
ACME-2511,Optimize Stripe billing,Story,Done,Low,Thomas Simon,Marc Dubois,13/Feb/25 12:00 AM,17/Feb/25 12:00 AM,17/Feb/25 12:00 AM,2,Sprint 11,"As a developer, I need to optimize Stripe billing to improve performance.",api
ACME-2512,Ci pipeline fails silently,Bug,In Progress,Low,Yuna Schmitt,Sophie Renard,21/Feb/25 12:00 AM,23/Feb/25 12:00 AM,,2,Sprint 11,**Bug:** CI pipeline fails silently **Impact:** Affects users in production.,security
ACME-2513,Responsive grid fails silently,Bug,Done,High,Yuna Schmitt,Sophie Renard,22/Feb/25 12:00 AM,26/Feb/25 12:00 AM,26/Feb/25 12:00 AM,5,Sprint 12,**Bug:** responsive grid fails silently **Impact:** Affects users in production.,regression
ACME-2514,Extend GraphQL schema,Story,Done,Medium,Yuna Schmitt,Marc Dubois,08/Feb/25 12:00 AM,10/Feb/25 12:00 AM,10/Feb/25 12:00 AM,13,Sprint 12,"As a developer, I want to extend GraphQL schema to support new use cases.",bug
ACME-2515,Build Zapier integration,Story,Done,Highest,Yuna Schmitt,Marc Dubois,20/Feb/25 12:00 AM,26/Feb/25 12:00 AM,26/Feb/25 12:00 AM,2,Sprint 11,"As an admin, I want to build Zapier integration to improve the team workflow.",performance
ACME-2516,Migrate multi-tenant isolation,Story,Done,Highest,Yuna Schmitt,Marc Dubois,28/Feb/25 12:00 AM,02/Mar/25 12:00 AM,02/Mar/25 12:00 AM,8,Sprint 12,"As a developer, I need to migrate multi-tenant isolation to reduce technical debt.",security
ACME-2517,Optimize Postgres indexes,Story,Done,High,Yuna Schmitt,Alice Martin,02/Feb/25 12:00 AM,04/Feb/25 12:00 AM,04/Feb/25 12:00 AM,13,Sprint 11,"As a developer, I need to optimize Postgres indexes to improve performance.",backend
ACME-2518,Add database migrations,Story,To Do,Low,Yuna Schmitt,Marc Dubois,10/Feb/25 12:00 AM,13/Feb/25 12:00 AM,,2,Sprint 11,"As a user, I want to add database migrations to get more value from the platform.",ux
ACME-2519,Build session management,Story,Done,High,Yuna Schmitt,David Chen,15/Feb/25 12:00 AM,16/Feb/25 12:00 AM,16/Feb/25 12:00 AM,8,Sprint 12,"As an admin, I want to build session management to improve the team workflow.",regression
ACME-2520,Migrate changelog page,Story,Done,Medium,Yuna Schmitt,David Chen,18/Feb/25 12:00 AM,23/Feb/25 12:00 AM,23/Feb/25 12:00 AM,13,Sprint 12,"As a developer, I need to migrate changelog page to reduce technical debt.",integration
ACME-2521,Integrate user segment filters,Story,Done,Highest,Yuna Schmitt,Marc Dubois,24/Feb/25 12:00 AM,25/Feb/25 12:00 AM,25/Feb/25 12:00 AM,2,Sprint 12,"As a user, I want to integrate user segment filters so that workflows are automated.",regression
ACME-2522,Changelog page breaks on concurrent requests,Bug,Done,High,Yuna Schmitt,Sophie Renard,28/Feb/25 12:00 AM,05/Mar/25 12:00 AM,05/Mar/25 12:00 AM,2,Sprint 12,**Bug:** changelog page breaks under concurrent load **Impact:** Race condition in production.,api
ACME-2523,Refactor changelog page,Story,Done,Medium,Yuna Schmitt,Alice Martin,22/Feb/25 12:00 AM,26/Feb/25 12:00 AM,26/Feb/25 12:00 AM,3,Sprint 11,"As a developer, I need to refactor changelog page to maintain code quality.",api
ACME-2524,Migrate infinite scroll,Story,Done,Highest,Yuna Schmitt,Marc Dubois,24/Feb/25 12:00 AM,26/Feb/25 12:00 AM,26/Feb/25 12:00 AM,2,Sprint 11,"As a developer, I need to migrate infinite scroll to reduce technical debt.",frontend
ACME-2525,Integrate drag-and-drop builder,Story,Done,High,Maya Kowalski,Alice Martin,01/Feb/25 12:00 AM,02/Feb/25 12:00 AM,02/Feb/25 12:00 AM,1,Sprint 11,"As a user, I want to integrate drag-and-drop builder so that workflows are automated.",integration
ACME-2526,Implement GraphQL schema,Story,Done,Medium,Maya Kowalski,Sophie Renard,15/Feb/25 12:00 AM,16/Feb/25 12:00 AM,16/Feb/25 12:00 AM,1,Sprint 11,"As a developer, I need to implement GraphQL schema to improve scalability.",api
ACME-2527,Configure GDPR export,Story,Done,High,Maya Kowalski,Marc Dubois,06/Feb/25 12:00 AM,07/Feb/25 12:00 AM,07/Feb/25 12:00 AM,1,Sprint 12,"As a developer, I need to configure GDPR export for better reliability.",regression
ACME-2528,Recommendation engine returns wrong data,Bug,Done,High,Maya Kowalski,David Chen,26/Feb/25 12:00 AM,27/Feb/25 12:00 AM,27/Feb/25 12:00 AM,8,Sprint 11,**Bug:** recommendation engine returns incorrect data **Impact:** Data integrity issue.,reporting
ACME-2529,Configure multi-tenant isolation,Story,In Progress,Low,Maya Kowalski,Marc Dubois,05/Feb/25 12:00 AM,07/Feb/25 12:00 AM,,8,Sprint 12,"As a developer, I need to configure multi-tenant isolation for better reliability.",integration
ACME-2530,Extend Postgres indexes,Story,Done,Medium,Maya Kowalski,Marc Dubois,23/Feb/25 12:00 AM,24/Feb/25 12:00 AM,24/Feb/25 12:00 AM,1,Sprint 11,"As a developer, I want to extend Postgres indexes to support new use cases.",frontend
ACME-2531,Integrate loading skeletons,Story,Done,Highest,Maya Kowalski,David Chen,20/Feb/25 12:00 AM,23/Feb/25 12:00 AM,23/Feb/25 12:00 AM,2,Sprint 11,"As a user, I want to integrate loading skeletons so that workflows are automated.",ui
ACME-2532,Migrate ML anomaly detection,Story,Done,High,Maya Kowalski,Alice Martin,19/Feb/25 12:00 AM,22/Feb/25 12:00 AM,22/Feb/25 12:00 AM,5,Sprint 12,"As a developer, I need to migrate ML anomaly detection to reduce technical debt.",bug
ACME-2533,User feedback widget fails silently,Bug,Done,Highest,Maya Kowalski,Marc Dubois,15/Feb/25 12:00 AM,16/Feb/25 12:00 AM,16/Feb/25 12:00 AM,1,Sprint 12,**Bug:** user feedback widget fails silently **Impact:** Affects users in production.,api
ACME-2534,Integrate GDPR export,Story,Done,Highest,Maya Kowalski,Marc Dubois,10/Feb/25 12:00 AM,12/Feb/25 12:00 AM,12/Feb/25 12:00 AM,2,Sprint 12,"As a user, I want to integrate GDPR export so that workflows are automated.",infra
ACME-2535,Implement Google OAuth,Story,Done,High,Maya Kowalski,Alice Martin,21/Feb/25 12:00 AM,25/Feb/25 12:00 AM,25/Feb/25 12:00 AM,5,Sprint 12,"As a developer, I need to implement Google OAuth to improve scalability.",security
ACME-2536,Refactor rate limiting,Story,Done,Highest,Maya Kowalski,Marc Dubois,03/Feb/25 12:00 AM,04/Feb/25 12:00 AM,04/Feb/25 12:00 AM,8,Sprint 12,"As a developer, I need to refactor rate limiting to maintain code quality.",frontend
ACME-2537,Build loading skeletons,Story,Done,Medium,Maya Kowalski,Alice Martin,28/Feb/25 12:00 AM,03/Mar/25 12:00 AM,03/Mar/25 12:00 AM,13,Sprint 12,"As an admin, I want to build loading skeletons to improve the team workflow.",ui
ACME-2538,Configure user segment filters,Story,Done,Medium,Maya Kowalski,David Chen,03/Feb/25 12:00 AM,04/Feb/25 12:00 AM,04/Feb/25 12:00 AM,3,Sprint 12,"As a developer, I need to configure user segment filters for better reliability.",backend
ACME-2539,Migrate CSV bulk import,Story,Done,Medium,Maya Kowalski,Marc Dubois,08/Feb/25 12:00 AM,09/Feb/25 12:00 AM,09/Feb/25 12:00 AM,2,Sprint 11,"As a developer, I need to migrate CSV bulk import to reduce technical debt.",ui
ACME-2540,Optimize ML anomaly detection,Story,Done,High,Maya Kowalski,David Chen,24/Feb/25 12:00 AM,25/Feb/25 12:00 AM,25/Feb/25 12:00 AM,5,Sprint 11,"As a developer, I need to optimize ML anomaly detection to improve performance.",ui
ACME-2541,Migrate saved filter presets,Story,Done,Medium,Maya Kowalski,David Chen,01/Feb/25 12:00 AM,02/Feb/25 12:00 AM,02/Feb/25 12:00 AM,3,Sprint 12,"As a developer, I need to migrate saved filter presets to reduce technical debt.",api
ACME-2542,Add user avatar upload,Story,In Progress,Low,Maya Kowalski,Marc Dubois,14/Feb/25 12:00 AM,16/Feb/25 12:00 AM,,5,Sprint 12,"As a user, I want to add user avatar upload to get more value from the platform.",ux
ACME-2543,Refactor Celery task queue,Story,Done,Medium,Maya Kowalski,David Chen,18/Feb/25 12:00 AM,21/Feb/25 12:00 AM,21/Feb/25 12:00 AM,5,Sprint 12,"As a developer, I need to refactor Celery task queue to maintain code quality.",bug
ACME-2544,Integrate Postgres indexes,Story,Done,Low,Maya Kowalski,Sophie Renard,16/Feb/25 12:00 AM,18/Feb/25 12:00 AM,18/Feb/25 12:00 AM,13,Sprint 11,"As a user, I want to integrate Postgres indexes so that workflows are automated.",performance
ACME-2545,Extend 2FA authentication,Story,Done,Medium,Maya Kowalski,Marc Dubois,10/Feb/25 12:00 AM,13/Feb/25 12:00 AM,13/Feb/25 12:00 AM,1,Sprint 12,"As a developer, I want to extend 2FA authentication to support new use cases.",backend
ACME-2546,Refactor CSV bulk import,Story,Won't Fix,High,Jules Nguyen,Alice Martin,10/Feb/25 12:00 AM,11/Feb/25 12:00 AM,,8,Sprint 11,"As a developer, I need to refactor CSV bulk import to maintain code quality.",backend
ACME-2547,Integrate health check endpoints,Story,Done,Low,Jules Nguyen,David Chen,01/Feb/25 12:00 AM,02/Feb/25 12:00 AM,02/Feb/25 12:00 AM,5,Sprint 11,"As a user, I want to integrate health check endpoints so that workflows are automated.",api
ACME-2548,Implement notification center,Story,In Progress,Highest,Jules Nguyen,Marc Dubois,20/Feb/25 12:00 AM,22/Feb/25 12:00 AM,,2,Sprint 12,"As a developer, I need to implement notification center to improve scalability.",reporting
ACME-2549,Optimize data export scheduler,Story,To Do,Medium,Jules Nguyen,Sophie Renard,17/Feb/25 12:00 AM,21/Feb/25 12:00 AM,,3,Sprint 12,"As a developer, I need to optimize data export scheduler to improve performance.",integration
ACME-2550,Connection pooling returns wrong data,Bug,Done,Medium,Jules Nguyen,Marc Dubois,26/Feb/25 12:00 AM,27/Feb/25 12:00 AM,27/Feb/25 12:00 AM,2,Sprint 12,**Bug:** connection pooling returns incorrect data **Impact:** Data integrity issue.,api
ACME-2551,Configure 2FA authentication,Story,Done,Highest,Jules Nguyen,Marc Dubois,08/Feb/25 12:00 AM,10/Feb/25 12:00 AM,10/Feb/25 12:00 AM,2,Sprint 11,"As a developer, I need to configure 2FA authentication for better reliability.",security
ACME-2552,Dark mode toggle fails silently,Bug,To Do,High,Jules Nguyen,Sophie Renard,27/Feb/25 12:00 AM,28/Feb/25 12:00 AM,,1,Sprint 12,**Bug:** dark mode toggle fails silently **Impact:** Affects users in production.,bug
ACME-2553,Add changelog page,Story,Done,Medium,Jules Nguyen,Sophie Renard,08/Feb/25 12:00 AM,09/Feb/25 12:00 AM,09/Feb/25 12:00 AM,2,Sprint 12,"As a user, I want to add changelog page to get more value from the platform.",infra
ACME-2554,A/b testing framework fails silently,Bug,In Progress,Medium,Jules Nguyen,Marc Dubois,25/Feb/25 12:00 AM,01/Mar/25 12:00 AM,,5,Sprint 11,**Bug:** A/B testing framework fails silently **Impact:** Affects users in production.,performance
ACME-2555,Build recommendation engine,Story,Won't Do,Medium,Jules Nguyen,David Chen,05/Feb/25 12:00 AM,09/Feb/25 12:00 AM,,8,Sprint 12,"As an admin, I want to build recommendation engine to improve the team workflow.",performance
ACME-2556,Websocket handler fails silently,Bug,Done,High,Jules Nguyen,Marc Dubois,17/Feb/25 12:00 AM,18/Feb/25 12:00 AM,18/Feb/25 12:00 AM,5,Sprint 11,**Bug:** WebSocket handler fails silently **Impact:** Affects users in production.,integration
ACME-2557,Add feature flags,Story,To Do,Highest,Jules Nguyen,David Chen,18/Feb/25 12:00 AM,23/Feb/25 12:00 AM,,13,Sprint 11,"As a user, I want to add feature flags to get more value from the platform.",frontend
ACME-2558,Refactor email templates,Story,Done,Low,Jules Nguyen,Alice Martin,06/Feb/25 12:00 AM,09/Feb/25 12:00 AM,09/Feb/25 12:00 AM,5,Sprint 12,"As a developer, I need to refactor email templates to maintain code quality.",frontend
ACME-2559,Configure drag-and-drop builder,Story,Done,High,Jules Nguyen,Sophie Renard,08/Feb/25 12:00 AM,09/Feb/25 12:00 AM,09/Feb/25 12:00 AM,1,Sprint 11,"As a developer, I need to configure drag-and-drop builder for better reliability.",bug
ACME-2560,Migrate A/B testing framework,Story,Done,High,Jules Nguyen,Alice Martin,14/Feb/25 12:00 AM,19/Feb/25 12:00 AM,19/Feb/25 12:00 AM,13,Sprint 11,"As a developer, I need to migrate A/B testing framework to reduce technical debt.",backend
ACME-2561,Set up SSO integration,Story,To Do,High,Jules Nguyen,Sophie Renard,09/Feb/25 12:00 AM,10/Feb/25 12:00 AM,,5,Sprint 12,"As a developer, I need to set up SSO integration for operational readiness.",backend
ACME-2562,Websocket handler not invalidated on update,Bug,Won't Do,Highest,Jules Nguyen,Alice Martin,08/Feb/25 12:00 AM,09/Feb/25 12:00 AM,,8,Sprint 11,**Bug:** WebSocket handler not invalidated after update **Impact:** Stale data shown.,infra
ACME-2563,Migrate email templates,Story,Done,Medium,Sofia Benali,Sophie Renard,25/Feb/25 12:00 AM,27/Feb/25 12:00 AM,27/Feb/25 12:00 AM,13,Sprint 11,"As a developer, I need to migrate email templates to reduce technical debt.",bug
ACME-2564,Build sandbox environment,Story,Done,Medium,Sofia Benali,Marc Dubois,24/Feb/25 12:00 AM,25/Feb/25 12:00 AM,25/Feb/25 12:00 AM,1,Sprint 11,"As an admin, I want to build sandbox environment to improve the team workflow.",bug
ACME-2565,Optimize audit trail viewer,Story,Done,High,Sofia Benali,Marc Dubois,21/Feb/25 12:00 AM,22/Feb/25 12:00 AM,22/Feb/25 12:00 AM,5,Sprint 12,"As a developer, I need to optimize audit trail viewer to improve performance.",backend
ACME-2566,Add keyboard shortcuts,Story,In Progress,High,Sofia Benali,David Chen,21/Feb/25 12:00 AM,24/Feb/25 12:00 AM,,5,Sprint 11,"As a user, I want to add keyboard shortcuts to get more value from the platform.",infra
ACME-2567,Integrate data anonymization,Story,In Progress,Medium,Sofia Benali,Sophie Renard,27/Feb/25 12:00 AM,28/Feb/25 12:00 AM,,13,Sprint 11,"As a user, I want to integrate data anonymization so that workflows are automated.",performance
ACME-2568,Configure Postgres indexes,Story,Done,Medium,Sofia Benali,Alice Martin,07/Feb/25 12:00 AM,12/Feb/25 12:00 AM,12/Feb/25 12:00 AM,1,Sprint 11,"As a developer, I need to configure Postgres indexes for better reliability.",api
ACME-2569,Configure RAG pipeline,Story,Done,High,Sofia Benali,Sophie Renard,21/Feb/25 12:00 AM,27/Feb/25 12:00 AM,27/Feb/25 12:00 AM,8,Sprint 11,"As a developer, I need to configure RAG pipeline for better reliability.",bug
ACME-2570,Ml anomaly detection timeout on large payload,Bug,Done,Medium,Sofia Benali,Sophie Renard,19/Feb/25 12:00 AM,20/Feb/25 12:00 AM,20/Feb/25 12:00 AM,3,Sprint 12,**Bug:** ML anomaly detection times out on large payloads **Impact:** Affects power users.,reporting
ACME-2571,Extend embedding pipeline,Story,Done,Medium,Sofia Benali,David Chen,28/Feb/25 12:00 AM,02/Mar/25 12:00 AM,02/Mar/25 12:00 AM,3,Sprint 11,"As a developer, I want to extend embedding pipeline to support new use cases.",reporting
ACME-2572,Optimize service account management,Story,Done,High,Sofia Benali,David Chen,15/Feb/25 12:00 AM,18/Feb/25 12:00 AM,18/Feb/25 12:00 AM,3,Sprint 12,"As a developer, I need to optimize service account management to improve performance.",performance
ACME-2573,Prompt safety layer crashes on null input,Bug,Done,Low,Sofia Benali,Sophie Renard,08/Feb/25 12:00 AM,11/Feb/25 12:00 AM,11/Feb/25 12:00 AM,1,Sprint 12,**Bug:** prompt safety layer crashes when input is null **Impact:** Affects edge cases.,frontend
ACME-2574,Optimize role badge system,Story,Done,Low,Sofia Benali,David Chen,15/Feb/25 12:00 AM,16/Feb/25 12:00 AM,16/Feb/25 12:00 AM,8,Sprint 12,"As a developer, I need to optimize role badge system to improve performance.",bug
ACME-2575,Build session management,Story,In Progress,Medium,Sofia Benali,Alice Martin,15/Feb/25 12:00 AM,18/Feb/25 12:00 AM,,5,Sprint 12,"As an admin, I want to build session management to improve the team workflow.",reporting
ACME-2576,Add infinite scroll,Story,Done,Low,Sofia Benali,Sophie Renard,26/Feb/25 12:00 AM,01/Mar/25 12:00 AM,01/Mar/25 12:00 AM,8,Sprint 11,"As a user, I want to add infinite scroll to get more value from the platform.",search
ACME-2577,Optimize Docker build,Story,Done,High,Sofia Benali,Marc Dubois,01/Feb/25 12:00 AM,02/Feb/25 12:00 AM,02/Feb/25 12:00 AM,1,Sprint 12,"As a developer, I need to optimize Docker build to improve performance.",frontend
ACME-2578,Add drag-and-drop builder,Story,Done,High,Sofia Benali,Alice Martin,07/Feb/25 12:00 AM,10/Feb/25 12:00 AM,10/Feb/25 12:00 AM,13,Sprint 12,"As a user, I want to add drag-and-drop builder to get more value from the platform.",infra
ACME-2579,Refactor A/B testing framework,Story,Done,High,Sofia Benali,Alice Martin,22/Feb/25 12:00 AM,24/Feb/25 12:00 AM,24/Feb/25 12:00 AM,5,Sprint 12,"As a developer, I need to refactor A/B testing framework to maintain code quality.",reporting
ACME-2580,Extend multi-tenant isolation,Story,Done,Medium,Eva Moreau,Alice Martin,11/Feb/25 12:00 AM,13/Feb/25 12:00 AM,13/Feb/25 12:00 AM,1,Sprint 12,"As a developer, I want to extend multi-tenant isolation to support new use cases.",performance
ACME-2581,Refactor API key rotation,Story,Done,Highest,Eva Moreau,Marc Dubois,06/Feb/25 12:00 AM,07/Feb/25 12:00 AM,07/Feb/25 12:00 AM,3,Sprint 12,"As a developer, I need to refactor API key rotation to maintain code quality.",api
ACME-2582,Add Redis cache,Story,In Progress,Medium,Eva Moreau,Sophie Renard,19/Feb/25 12:00 AM,22/Feb/25 12:00 AM,,1,Sprint 11,"As a user, I want to add Redis cache to get more value from the platform.",ux
ACME-2583,Set up Kubernetes autoscaling,Story,Done,High,Eva Moreau,Sophie Renard,19/Feb/25 12:00 AM,20/Feb/25 12:00 AM,20/Feb/25 12:00 AM,5,Sprint 12,"As a developer, I need to set up Kubernetes autoscaling for operational readiness.",performance
ACME-2584,Redis cache fails silently,Bug,Done,Medium,Eva Moreau,David Chen,07/Feb/25 12:00 AM,09/Feb/25 12:00 AM,09/Feb/25 12:00 AM,8,Sprint 11,**Bug:** Redis cache fails silently **Impact:** Affects users in production.,infra
ACME-2585,Implement drag-and-drop builder,Story,Done,High,Eva Moreau,David Chen,05/Feb/25 12:00 AM,08/Feb/25 12:00 AM,08/Feb/25 12:00 AM,2,Sprint 11,"As a developer, I need to implement drag-and-drop builder to improve scalability.",integration
ACME-2586,Implement responsive grid,Story,In Progress,Medium,Eva Moreau,Alice Martin,14/Feb/25 12:00 AM,16/Feb/25 12:00 AM,,1,Sprint 12,"As a developer, I need to implement responsive grid to improve scalability.",bug
ACME-2587,Optimize responsive grid,Story,Done,High,Eva Moreau,Alice Martin,20/Feb/25 12:00 AM,23/Feb/25 12:00 AM,23/Feb/25 12:00 AM,1,Sprint 11,"As a developer, I need to optimize responsive grid to improve performance.",regression
ACME-2588,User avatar upload timeout on large payload,Bug,Done,Medium,Eva Moreau,David Chen,20/Feb/25 12:00 AM,21/Feb/25 12:00 AM,21/Feb/25 12:00 AM,3,Sprint 12,**Bug:** user avatar upload times out on large payloads **Impact:** Affects power users.,backend
ACME-2589,Refactor JWT middleware,Story,Done,Medium,Eva Moreau,Marc Dubois,08/Feb/25 12:00 AM,12/Feb/25 12:00 AM,12/Feb/25 12:00 AM,13,Sprint 11,"As a developer, I need to refactor JWT middleware to maintain code quality.",ux
ACME-2590,Configure API gateway,Story,Done,Medium,Eva Moreau,Sophie Renard,26/Feb/25 12:00 AM,27/Feb/25 12:00 AM,27/Feb/25 12:00 AM,2,Sprint 12,"As a developer, I need to configure API gateway for better reliability.",regression
ACME-2591,Audit trail viewer crashes on null input,Bug,Done,Medium,Eva Moreau,Alice Martin,19/Feb/25 12:00 AM,21/Feb/25 12:00 AM,21/Feb/25 12:00 AM,8,Sprint 11,**Bug:** audit trail viewer crashes when input is null **Impact:** Affects edge cases.,api
ACME-2592,Configure data export scheduler,Story,Done,Low,Eva Moreau,Sophie Renard,22/Feb/25 12:00 AM,23/Feb/25 12:00 AM,23/Feb/25 12:00 AM,2,Sprint 11,"As a developer, I need to configure data export scheduler for better reliability.",integration
ACME-2593,Extend referral tracking,Story,In Progress,High,Eva Moreau,David Chen,12/Feb/25 12:00 AM,15/Feb/25 12:00 AM,,3,Sprint 11,"As a developer, I want to extend referral tracking to support new use cases.",bug
ACME-2594,Extend keyboard shortcuts,Story,Done,High,Eva Moreau,Alice Martin,23/Feb/25 12:00 AM,24/Feb/25 12:00 AM,24/Feb/25 12:00 AM,8,Sprint 11,"As a developer, I want to extend keyboard shortcuts to support new use cases.",backend
